{"topic":"Preposições com acusativo","level":"A1","source_topic_order":34,"mode":"mastery","description":"Suplemento grande de domínio para praticar für, ohne, gegen, durch, um e bis com foco em acusativo A1.","exercises":[{"type":"fill_blank","title":"Artigo definido depois da preposição","instruction":"Complete com den, die ou das.","items":[{"type":"fill_blank","question":"Das Paket ist für ___ Nachbarn.","answer":"den","explanation":"Für pede acusativo; der Nachbar vira den Nachbarn."},{"type":"fill_blank","question":"Lena geht ohne ___ Jacke aus dem Haus.","answer":"die","explanation":"Ohne pede acusativo; feminino die não muda."},{"type":"fill_blank","question":"Der Weg geht durch ___ Wald.","answer":"den","explanation":"Durch pede acusativo; der Wald vira den Wald."},{"type":"fill_blank","question":"Das Auto fährt gegen ___ Mauer.","answer":"die","explanation":"Gegen pede acusativo; feminino die permanece die."},{"type":"fill_blank","question":"Wir sitzen um ___ Tisch.","answer":"den","explanation":"Um pede acusativo; der Tisch vira den Tisch."},{"type":"fill_blank","question":"Der Brief ist für ___ Kind.","answer":"das","explanation":"Für pede acusativo; neutro das não muda."},{"type":"fill_blank","question":"Sie läuft durch ___ Straße.","answer":"die","explanation":"Durch pede acusativo; die Straße fica die Straße."},{"type":"fill_blank","question":"Der Junge läuft um ___ Garten.","answer":"den","explanation":"Um pede acusativo; der Garten vira den Garten."}]},{"type":"fill_blank","title":"Artigo indefinido masculino e neutro","instruction":"Complete com einen, eine ou ein.","items":[{"type":"fill_blank","question":"Ich kaufe Blumen für ___ Freund.","answer":"einen","explanation":"Freund é masculino; ein vira einen no acusativo."},{"type":"fill_blank","question":"Mara geht ohne ___ Tasche.","answer":"eine","explanation":"Tasche é feminino; eine não muda no acusativo."},{"type":"fill_blank","question":"Wir laufen durch ___ Dorf.","answer":"ein","explanation":"Dorf é neutro; ein não muda no acusativo."},{"type":"fill_blank","question":"Der Ball rollt gegen ___ Stuhl.","answer":"einen","explanation":"Stuhl é masculino; ein vira einen depois de gegen."},{"type":"fill_blank","question":"Sie wartet um ___ Moment.","answer":"einen","explanation":"Moment é masculino; um pede acusativo."},{"type":"fill_blank","question":"Paul fährt bis ___ kleines Hotel.","answer":"ein","explanation":"Hotel é neutro; ein permanece ein no acusativo."},{"type":"fill_blank","question":"Das ist für ___ Lehrerin.","answer":"eine","explanation":"Lehrerin é feminino; eine permanece igual."},{"type":"fill_blank","question":"Ich gehe ohne ___ Regenschirm.","answer":"einen","explanation":"Regenschirm é masculino; ohne pede acusativo."}]},{"type":"multiple_choice","title":"Escolha a expressão correta","instruction":"Escolha a opção correta em alemão.","items":[{"type":"multiple_choice","question":"para o chefe","answer":"für den Chef","distractors":["für der Chef","für dem Chef"],"explanation":"Für pede acusativo; der Chef vira den Chef."},{"type":"multiple_choice","question":"sem uma mochila","answer":"ohne einen Rucksack","distractors":["ohne ein Rucksack","ohne einem Rucksack"],"explanation":"Rucksack é masculino; ein vira einen."},{"type":"multiple_choice","question":"pelo centro","answer":"durch das Zentrum","distractors":["durch dem Zentrum","durch den Zentrum"],"explanation":"Zentrum é neutro; das permanece das."},{"type":"multiple_choice","question":"contra a porta","answer":"gegen die Tür","distractors":["gegen der Tür","gegen den Tür"],"explanation":"Tür é feminino; die fica die no acusativo."},{"type":"multiple_choice","question":"ao redor do lago","answer":"um den See","distractors":["um der See","um dem See"],"explanation":"See aqui é masculino; um pede acusativo, então den See."},{"type":"multiple_choice","question":"até Hamburgo","answer":"bis Hamburg","distractors":["gegen Hamburg","durch Hamburg"],"explanation":"Bis indica até; com cidade sem artigo, use bis Hamburg."},{"type":"multiple_choice","question":"para a família","answer":"für die Familie","distractors":["für der Familie","für den Familie"],"explanation":"Familie é feminino; die permanece die."},{"type":"multiple_choice","question":"sem o celular","answer":"ohne das Handy","distractors":["ohne dem Handy","ohne den Handy"],"explanation":"Handy é neutro; das permanece das."}]},{"type":"translation","title":"Tradução curta para o alemão","instruction":"Traduza as expressões para o alemão.","items":[{"type":"translation","question":"para o médico","answer":"für den Arzt","explanation":"Arzt é masculino; depois de für fica den Arzt."},{"type":"translation","question":"sem uma chave","answer":"ohne einen Schlüssel","explanation":"Schlüssel é masculino; ein vira einen."},{"type":"translation","question":"pelo jardim","answer":"durch den Garten","explanation":"Garten é masculino; durch pede acusativo."},{"type":"translation","question":"contra uma parede","answer":"gegen eine Wand","explanation":"Wand é feminino; eine permanece eine."},{"type":"translation","question":"às quatro horas","answer":"um vier Uhr","explanation":"Para horas, usa-se um + hora."},{"type":"translation","question":"até sábado","answer":"bis Samstag","explanation":"Com dias sem artigo, bis aparece sozinho."},{"type":"translation","question":"para a professora","answer":"für die Lehrerin","explanation":"Lehrerin é feminino; die não muda."},{"type":"translation","question":"sem o bilhete","answer":"ohne das Ticket","explanation":"Ticket é neutro; das permanece das."}]},{"type":"correction","title":"Corrija os erros de caso","instruction":"Corrija a expressão alemã.","items":[{"type":"correction","question":"für der Bruder","answer":"für den Bruder","explanation":"Für pede acusativo; der Bruder vira den Bruder."},{"type":"correction","question":"ohne ein Hund","answer":"ohne einen Hund","explanation":"Hund é masculino; ein vira einen no acusativo."},{"type":"correction","question":"durch dem Tunnel","answer":"durch den Tunnel","explanation":"Durch pede acusativo; der Tunnel vira den Tunnel."},{"type":"correction","question":"gegen der Baum","answer":"gegen den Baum","explanation":"Baum é masculino; gegen pede acusativo."},{"type":"correction","question":"um dem Platz","answer":"um den Platz","explanation":"Platz é masculino; um pede acusativo."},{"type":"correction","question":"für den Schwester","answer":"für die Schwester","explanation":"Schwester é feminino; o artigo correto é die."},{"type":"correction","question":"ohne einen Auto","answer":"ohne ein Auto","explanation":"Auto é neutro; ein não muda no acusativo."},{"type":"correction","question":"durch der Stadt","answer":"durch die Stadt","explanation":"Stadt é feminino; die permanece die."}]},{"type":"classification","title":"Preposição e sentido","instruction":"Identifique o sentido principal da preposição em português.","items":[{"type":"classification","question":"für","answer":"para","explanation":"Für normalmente significa para em contextos A1."},{"type":"classification","question":"ohne","answer":"sem","explanation":"Ohne indica ausência: sem algo ou alguém."},{"type":"classification","question":"gegen","answer":"contra","explanation":"Gegen pode significar contra."},{"type":"classification","question":"durch","answer":"por/através de","explanation":"Durch indica atravessar, passar por ou através de."},{"type":"classification","question":"um + hora","answer":"às","explanation":"Com horas, um equivale a às: um acht Uhr."},{"type":"classification","question":"um + lugar/coisa","answer":"ao redor de","explanation":"Com espaço, um pode indicar ao redor de."},{"type":"classification","question":"bis","answer":"até","explanation":"Bis indica limite: até um lugar ou tempo."},{"type":"classification","question":"ohne dich","answer":"sem você","explanation":"Ohne pode aparecer também com pronomes no acusativo."}]},{"type":"transformation","title":"Troque para acusativo masculino","instruction":"Reescreva a expressão com o artigo correto no acusativo.","items":[{"type":"transformation","question":"für + der Sohn","answer":"für den Sohn","explanation":"Sohn é masculino; der vira den."},{"type":"transformation","question":"ohne + ein Kaffee","answer":"ohne einen Kaffee","explanation":"Kaffee é masculino; ein vira einen."},{"type":"transformation","question":"durch + der Eingang","answer":"durch den Eingang","explanation":"Eingang é masculino; der vira den."},{"type":"transformation","question":"gegen + ein Tisch","answer":"gegen einen Tisch","explanation":"Tisch é masculino; ein vira einen."},{"type":"transformation","question":"um + der Supermarkt","answer":"um den Supermarkt","explanation":"Supermarkt é masculino; um pede acusativo."},{"type":"transformation","question":"bis + Montag","answer":"bis Montag","explanation":"Com dias sem artigo, use bis + dia."},{"type":"transformation","question":"für + ein Kollegen","answer":"für einen Kollegen","explanation":"Kollege é masculino fraco; no nível A1 foque em einen antes do substantivo."},{"type":"transformation","question":"ohne + der Plan","answer":"ohne den Plan","explanation":"Plan é masculino; der vira den."}]},{"type":"short_answer","title":"Responda com uma expressão curta","instruction":"Responda em alemão com a preposição correta.","items":[{"type":"short_answer","question":"Você quer dizer 'para Max'.","answer":"für Max","explanation":"Com nome próprio sem artigo, use für + nome."},{"type":"short_answer","question":"Você quer dizer 'sem Anna'.","answer":"ohne Anna","explanation":"Com nome próprio, ohne aparece diretamente antes do nome."},{"type":"short_answer","question":"Você quer dizer 'até Berlim'.","answer":"bis Berlin","explanation":"Com cidade sem artigo, usa-se bis + cidade."},{"type":"short_answer","question":"Você quer dizer 'às seis horas'.","answer":"um sechs Uhr","explanation":"Horas usam um."},{"type":"short_answer","question":"Você quer dizer 'contra o vento'.","answer":"gegen